measureId,measureDescription,lastMeasureUpdate,area,status,restrictiveMeasures,startDate,endDate,notes
1,Schools/Univ. closure,2020-10-12T00:00:00,National,Open,Mandatory,2020-08-18T00:00:00,2020-12-31T00:00:00,"
"
2,National movement restrictions,2020-10-12T00:00:00,Sub-National,Free,Recommended,2020-09-20T00:00:00,2020-12-31T00:00:00,"As of October 2 the following applies for masks:
New advice for masks in public buildings
Wear a face mask in public buildings.
This is urgent advice.
These are non-medical face masks.
The advice applies to all people from the age of 13.

Examples of these buildings are:

stores
museums
town halls
stations
airports
parking garages
gas stations
restaurants and cafes
theaters and concert halls.

Rules for indoors
Working from home remains the norm, unless that is really not possible. If contamination does occur in a work situation, the work location can be closed for 14 days.
Visits in your own home, in the garden or on the balcony are limited to 3 guests. This applies in addition to your own household and excluding children up to and including 12 years old.
In buildings other than the owner-occupied home, a group may be formed with a maximum of 4 people. Children up to and including 12 are not included. This means that a reservation at a cinema or restaurant can be made for 1 household or a maximum of 4 people, excluding children.
The number of people per room is limited to 30. This includes children up to and including 12 years old and excluding staff.
Food and beverage outlets open until 9 p.m., the store is closed at 10 p.m.
Sports canteens are closed.
For indoor spaces with a flow of visitors, such as in monuments, libraries and museums, visits are based on a reservation per period. Markets and retail are excluded from this.
People with a contact profession ask their customers to register, just like in the hospitality industry.
Rules for outside
For activities outside, where there is no continuous flow of people, a maximum of 40 people applies. This includes children up to and including 12 years old and excluding staff.
If there is a continuous flow of people outside, such as in zoos or markets, there is a standard for the number of visitors per square meter.
Sports competitions, both amateur and professional, take place without an audience.
The advice is to limit the number of travel movements as much as possible.

Exceptions applies as per Source #2
Local additional measures might be applied in regions with higher positives as per source #3."
3,International movement restrictions,2020-09-08T00:00:00,National,Partially banned,Mandatory,2020-06-15T00:00:00,2020-12-31T00:00:00,"Have you been on holiday in an area with a lot of infections?

Stay at home for 10 days.
Get tested.


From June 15 traveling within Europe is possible in the following countries: Belgium, Bulgaria, Germany, Estonia, France, Iceland, Italy, Croatia, Latvia, Liechtenstein, Lithuania, Luxembourg, Poland, Portugal, the Czech Republic and Switzerland. Traveling outside Europe is not recommended to limit the risks of a new outbreak. 
From June 15 tourists are allowed to travel to the Netherlands this summer. But only tourists from countries with about the same situation as in the Netherlands and must adhere to the Dutch rules.

As of 1 July 2020, the Netherlands has lifted the travel ban for travelers who reside permanently in the following countries: Algeria, Australia, Canada, Georgia, Japan, Montenegro, Morocco, New Zealand, Rwanda, Serbia, South Korea, Thailand, Tunisia, Uruguay. For travelers from China, the entry ban will be lifted as soon as the country also allows EU citizens.
Exceptions apply for specific cases. 
The Netherlands has reintroduced the entry ban for Serbia and Montenegro on 8 July 2020.
The Netherlands has reintroduced the entry ban for Algeria on 5 August 2020 at midnight. 
Travellers arriving in the Netherlands from certain countries and regions are strongly advised to self-quarantine for 14 days. Even if you do not have any symptoms or if you have tested negative for COVID-19. This applies to anyone aged 13 and over.  You are strongly advised to self-quarantine if you're travelling from: 

Sweden
Romania
Bulgaria
Croatia
3 areas in Spain (Segrià, La Mariña-Lugo and Barcelona)
1 area in Portugal (Vale do Tejo, this includes Lisbon)
1 area in the United Kingdom (Leicester)
1 area in Belgium (Antwerp);
countries outside the EU, the Schengen area and the United Kingdom."
4,Flight restrictions,2020-09-08T00:00:00,National,Partially cancelled,Mandatory,2020-06-15T00:00:00,2020-12-31T00:00:00,"From June 15 traveling within Europe is possible in the following countries: Belgium, Bulgaria, Germany, Estonia, France, Iceland, Italy, Croatia, Latvia, Liechtenstein, Lithuania, Luxembourg, Poland, Portugal, the Czech Republic and Switzerland. Traveling outside Europe is not recommended to limit the risks of a new outbreak. "
5,Non-essential shops closure,2020-10-12T00:00:00,Sub-National,Open,Mandatory,2020-10-02T00:00:00,2020-12-31T00:00:00,"Food and beverage outlets open until 9 p.m., the store is closed at 10 p.m.
Sports canteens are closed.
For indoor spaces with a flow of visitors, such as in monuments, libraries and museums, visits are based on a reservation per period. Markets and retail are excluded from this.
People with a contact profession ask their customers to register, just like in the hospitality industry."
6,Events stop,2020-10-12T00:00:00,Sub-National,Partially banned,Mandatory,2020-10-02T00:00:00,2020-12-31T00:00:00,"Visits in your own home, in the garden or on the balcony are limited to 3 guests. This applies in addition to your own household and excluding children up to and including 12 years old.
In buildings other than the owner-occupied home, a group may be formed with a maximum of 4 people. Children up to and including 12 are not included. This means that a reservation at a cinema or restaurant can be made for 1 household or a maximum of 4 people, excluding children.
The number of people per room is limited to 30. This includes children up to and including 12 years old and excluding staff."
7,Other,2020-04-15T00:00:00,National,closed/cancelled,Mandatory,,,
